{"$id":"urn:otqa:v2:summary","$schema":"https://json-schema.org/draft/2020-12/schema","additionalProperties":false,"properties":{"audit":{"$ref":"urn:otqa:v2:common#/$defs/FileRef"},"basis":{"const":"verified_raw_attempts"},"generated_at_utc":{"format":"date-time","pattern":"Z$","type":"string"},"groups":{"items":{"$ref":"urn:otqa:v2:common#/$defs/SummaryGroup"},"minItems":1,"type":"array"},"plan":{"$ref":"urn:otqa:v2:common#/$defs/FileRef"},"prefix_snapshots":{"items":{"$ref":"urn:otqa:v2:common#/$defs/FileRef"},"minItems":0,"type":"array"},"rows":{"items":{"$ref":"urn:otqa:v2:common#/$defs/SummaryRow"},"minItems":1,"type":"array"},"schema_version":{"const":2},"scope":{"enum":["complete","partial"]},"series_id":{"format":"uuid","type":"string"},"state":{"$ref":"urn:otqa:v2:common#/$defs/FileRef"}},"required":["schema_version","series_id","generated_at_utc","scope","basis","plan","state","audit","prefix_snapshots","rows","groups"],"type":"object"}
