{"audit":{"path":"reports/7d35f9cd-abc8-5b37-bcc5-f702e86de596/audit.json","sha256":"10de1b2370c53f36143587d17cb5174b802391d9f70cf2e2dd526f89da3d4ce4"},"basis":"verified_raw_attempts","generated_at_utc":"2026-10-17T23:16:51.218714Z","groups":[{"alternative_count":5,"answered_new_completed":{"maximum":54,"mean":8.44,"median":6.0,"minimum":2,"n":100,"p90":17.10000000000001,"total":844},"answered_new_correct":{"maximum":54,"mean":8.44,"median":6.0,"minimum":2,"n":100,"p90":17.10000000000001,"total":844},"answered_new_solved":{"maximum":54,"mean":8.44,"median":6.0,"minimum":2,"n":100,"p90":17.10000000000001,"total":844},"completed_call_time":{"maximum":18.622110111999973,"mean":3.163400893010039,"median":2.031413276999956,"minimum":0.985721499999272,"n":100,"p90":5.927450167400467,"total":316.3400893010039},"completed_native":100,"completed_sample_job_ids":["job000001","job000002","job000003","job000004","job000005","job000006","job000007","job000008","job000009","job000010","job000011","job000012","job000013","job000014","job000015","job000016","job000017","job000018","job000019","job000020","job000021","job000022","job000023","job000024","job000025","job000026","job000027","job000028","job000029","job000030","job000031","job000032","job000033","job000034","job000035","job000036","job000037","job000038","job000039","job000040","job000041","job000042","job000043","job000044","job000045","job000046","job000047","job000048","job000049","job000050","job000051","job000052","job000053","job000054","job000055","job000056","job000057","job000058","job000059","job000060","job000061","job000062","job000063","job000064","job000065","job000066","job000067","job000068","job000069","job000070","job000071","job000072","job000073","job000074","job000075","job000076","job000077","job000078","job000079","job000080","job000081","job000082","job000083","job000084","job000085","job000086","job000087","job000088","job000089","job000090","job000091","job000092","job000093","job000094","job000095","job000096","job000097","job000098","job000099","job000100"],"confidence_stops":0,"configuration_id":"d5-a5-n100-h2-grid10-grid-plus-ratio-countdown-stop-single-candidate-minprog0p001-src72072-config","controller_attempt_time":{"maximum":19.946845829000267,"mean":3.797875235620022,"median":2.6411892059995807,"minimum":1.5458397129996229,"n":100,"p90":6.707242421399325,"total":379.7875235620022},"correct":100,"correct_sample_job_ids":["job000001","job000002","job000003","job000004","job000005","job000006","job000007","job000008","job000009","job000010","job000011","job000012","job000013","job000014","job000015","job000016","job000017","job000018","job000019","job000020","job000021","job000022","job000023","job000024","job000025","job000026","job000027","job000028","job000029","job000030","job000031","job000032","job000033","job000034","job000035","job000036","job000037","job000038","job000039","job000040","job000041","job000042","job000043","job000044","job000045","job000046","job000047","job000048","job000049","job000050","job000051","job000052","job000053","job000054","job000055","job000056","job000057","job000058","job000059","job000060","job000061","job000062","job000063","job000064","job000065","job000066","job000067","job000068","job000069","job000070","job000071","job000072","job000073","job000074","job000075","job000076","job000077","job000078","job000079","job000080","job000081","job000082","job000083","job000084","job000085","job000086","job000087","job000088","job000089","job000090","job000091","job000092","job000093","job000094","job000095","job000096","job000097","job000098","job000099","job000100"],"correct_solution_time":{"maximum":18.622110111999973,"mean":3.163400893010039,"median":2.031413276999956,"minimum":0.985721499999272,"n":100,"p90":5.927450167400467,"total":316.3400893010039},"depth":2,"failed":0,"failed_api_call_time":{"maximum":null,"mean":null,"median":null,"minimum":null,"n":0,"p90":null,"total":null},"horizon_execution":"countdown","incorrect":0,"insufficient_expected_progress":0,"interrupted":0,"launching":0,"min_expected_progress":0.001,"no_query":0,"objective_count":5,"pending":0,"planned_jobs":100,"query_cap":0,"query_strategy":"fixed","running":0,"singleton_stops":100,"solution_sample_job_ids":["job000001","job000002","job000003","job000004","job000005","job000006","job000007","job000008","job000009","job000010","job000011","job000012","job000013","job000014","job000015","job000016","job000017","job000018","job000019","job000020","job000021","job000022","job000023","job000024","job000025","job000026","job000027","job000028","job000029","job000030","job000031","job000032","job000033","job000034","job000035","job000036","job000037","job000038","job000039","job000040","job000041","job000042","job000043","job000044","job000045","job000046","job000047","job000048","job000049","job000050","job000051","job000052","job000053","job000054","job000055","job000056","job000057","job000058","job000059","job000060","job000061","job000062","job000063","job000064","job000065","job000066","job000067","job000068","job000069","job000070","job000071","job000072","job000073","job000074","job000075","job000076","job000077","job000078","job000079","job000080","job000081","job000082","job000083","job000084","job000085","job000086","job000087","job000088","job000089","job000090","job000091","job000092","job000093","job000094","job000095","job000096","job000097","job000098","job000099","job000100"],"solution_time":{"maximum":18.622110111999973,"mean":3.163400893010039,"median":2.031413276999956,"minimum":0.985721499999272,"n":100,"p90":5.927450167400467,"total":316.3400893010039},"solved":100,"total_attempts":100,"unique_cases":100,"unknown_controller_attempt_times":0,"unknown_quality":0}],"plan":{"path":"plan.json","sha256":"a4c64a88f9c34f2e81ab35cb03b05e882b9a4326420f15141e23d79dcf94692f"},"prefix_snapshots":[],"rows":[{"accepted_attempt_id":"attempt0001","alternative_count":5,"api_call_wall_seconds":2.2298893899996983,"attempt_results":[{"path":"jobs/job000001/attempts/attempt0001/result.json","sha256":"95cdd4198e6ace6c4df568627c428cae720ed72182fe0d185a4409abfbed70b3"}],"case_id":"d5-m5-c000000","configuration_id":"d5-a5-n100-h2-grid10-grid-plus-ratio-countdown-stop-single-candidate-minprog0p001-src72072-config","depth":2,"fallback_selections":0,"horizon_execution":"countdown","job_id":"job000001","min_expected_progress":0.001,"objective_count":5,"planning_attempts_completed":10,"planning_attempts_started":10,"quality_status":"correct","query_counts":{"answered_new":10,"answered_total":10,"dispatched_new":10,"initial_answers":0},"query_strategy":"fixed","repetition_index":0,"selected_candidate_id":"a2","solved":true,"status":"completed","terminal_expected_progress":null,"terminal_planning_depth":null,"termination_reason":"exact_single_candidate"},{"accepted_attempt_id":"attempt0001","alternative_count":5,"api_call_wall_seconds":3.5811772880006174,"attempt_results":[{"path":"jobs/job000002/attempts/attempt0001/result.json","sha256":"75b4c458f54eb3683b45c60f1c505b264c8abd5c69de164655b8540887f7dda5"}],"case_id":"d5-m5-c000001","configuration_id":"d5-a5-n100-h2-grid10-grid-plus-ratio-countdown-stop-single-candidate-minprog0p001-src72072-config","depth":2,"fallback_selections":0,"horizon_execution":"countdown","job_id":"job000002","min_expected_progress":0.001,"objective_count":5,"planning_attempts_completed":8,"planning_attempts_started":8,"quality_status":"correct","query_counts":{"answered_new":8,"answered_total":8,"dispatched_new":8,"initial_answers":0},"query_strategy":"fixed","repetition_index":0,"selected_candidate_id":"a4","solved":true,"status":"completed","terminal_expected_progress":null,"terminal_planning_depth":null,"termination_reason":"exact_single_candidate"},{"accepted_attempt_id":"attempt0001","alternative_count":5,"api_call_wall_seconds":1.8667813909996767,"attempt_results":[{"path":"jobs/job000003/attempts/attempt0001/result.json","sha256":"f16aa32caf07848a9a16197c9d1f9ae617fa3e65cb35571b8c24bea4b9249ea2"}],"case_id":"d5-m5-c000002","configuration_id":"d5-a5-n100-h2-grid10-grid-plus-ratio-countdown-stop-single-candidate-minprog0p001-src72072-config","depth":2,"fallback_selections":0,"horizon_execution":"countdown","job_id":"job000003","min_expected_progress":0.001,"objective_count":5,"planning_attempts_completed":4,"planning_attempts_started":4,"quality_status":"correct","query_counts":{"answered_new":4,"answered_total":4,"dispatched_new":4,"initial_answers":0},"query_strategy":"fixed","repetition_index":0,"selected_candidate_id":"a1","solved":true,"status":"completed","terminal_expected_progress":null,"terminal_planning_depth":null,"termination_reason":"exact_single_candidate"},{"accepted_attempt_id":"attempt0001","alternative_count":5,"api_call_wall_seconds":1.4599452399997972,"attempt_results":[{"path":"jobs/job000004/attempts/attempt0001/result.json","sha256":"86a91b3bd975a9b6ffbd3f68763fe5cc23eb8ab04ee5ce731523df708e5a89bf"}],"case_id":"d5-m5-c000003","configuration_id":"d5-a5-n100-h2-grid10-grid-plus-ratio-countdown-stop-single-candidate-minprog0p001-src72072-config","depth":2,"fallback_selections":0,"horizon_execution":"countdown","job_id":"job000004","min_expected_progress":0.001,"objective_count":5,"planning_attempts_completed":4,"planning_attempts_started":4,"quality_status":"correct","query_counts":{"answered_new":4,"answered_total":4,"dispatched_new":4,"initial_answers":0},"query_strategy":"fixed","repetition_index":0,"selected_candidate_id":"a2","solved":true,"status":"completed","terminal_expected_progress":null,"terminal_planning_depth":null,"termination_reason":"exact_single_candidate"},{"accepted_attempt_id":"attempt0001","alternative_count":5,"api_call_wall_seconds":4.66622756400011,"attempt_results":[{"path":"jobs/job000005/attempts/attempt0001/result.json","sha256":"8ccc7cf7667e3f2010d5689ccf971bdb3e39176d894b1b1d8bb49d640550c9d7"}],"case_id":"d5-m5-c000004","configuration_id":"d5-a5-n100-h2-grid1